{
  "id": "anim.acrobatie.t4.frontflip",
  "version": 1,
  "name": {
    "fr": "Salto avant"
  },
  "icon": "🎢",
  "move": {
    "style": "acrobatie",
    "tier": 4
  },
  "rarity": "epic",
  "loop": {
    "duration": 2.1,
    "weights": [0.2, 0.12, 0.16, 0.12, 0.2, 0.2],
    "ease": true
  },
  "flags": {
    "expression": "neutral"
  },
  "sound": [
    {
      "at": 0.3,
      "accent": "whoosh"
    },
    {
      "at": 0.6,
      "accent": "impact"
    }
  ],
  "hands": [
    ["fist", "in"],
    ["fist", "in"]
  ],
  "frames": [
    {
      "joints": {
        "head": [5, -126],
        "neck": [2, -110],
        "hip": [-6, -62],
        "le": [-14, -92],
        "lh": [-28, -78],
        "re": [-10, -92],
        "rh": [-24, -76],
        "lk": [12, -34],
        "lf": [0, 0],
        "rk": [14, -34],
        "rf": [4, 0]
      },
      "lift": 0,
      "pitch": 0
    },
    {
      "joints": {
        "head": [0, -156],
        "neck": [0, -138],
        "hip": [0, -84],
        "le": [-4, -162],
        "lh": [-6, -190],
        "re": [4, -162],
        "rh": [6, -190],
        "lk": [0, -42],
        "lf": [-2, -2],
        "rk": [2, -42],
        "rf": [2, -2]
      },
      "lift": -45,
      "pitch": -0.7
    },
    {
      "joints": {
        "head": [9, -146],
        "neck": [4, -130],
        "hip": [-2, -82],
        "le": [10, -116],
        "lh": [26, -96],
        "re": [10, -116],
        "rh": [26, -96],
        "lk": [24, -108],
        "lf": [12, -70],
        "rk": [26, -110],
        "rf": [14, -72]
      },
      "z": {
        "le": -18,
        "lh": -12,
        "re": 18,
        "rh": 12,
        "lk": -7,
        "lf": -7,
        "rk": 7,
        "rf": 7
      },
      "lift": -95,
      "pitch": -3.1
    },
    {
      "joints": {
        "head": [0, -152],
        "neck": [0, -134],
        "hip": [0, -82],
        "le": [20, -146],
        "lh": [42, -150],
        "re": [22, -144],
        "rh": [44, -152],
        "lk": [8, -44],
        "lf": [0, -6],
        "rk": [10, -44],
        "rf": [4, -6]
      },
      "lift": -55,
      "pitch": -5.5
    },
    {
      "joints": {
        "head": [12, -126],
        "neck": [6, -110],
        "hip": [-10, -60],
        "le": [28, -102],
        "lh": [52, -98],
        "re": [30, -106],
        "rh": [54, -104],
        "lk": [14, -32],
        "lf": [0, 0],
        "rk": [16, -32],
        "rf": [4, 0]
      },
      "lift": 0,
      "pitch": -6.2
    },
    {
      "joints": {
        "head": [11, -128],
        "neck": [5, -112],
        "hip": [-9, -62],
        "le": [24, -100],
        "lh": [46, -92],
        "re": [26, -104],
        "rh": [48, -98],
        "lk": [14, -33],
        "lf": [0, 0],
        "rk": [16, -33],
        "rf": [4, 0]
      },
      "lift": 0,
      "pitch": 0
    }
  ]
}
