{
  "id": "anim.prouesse.t4.lsit",
  "version": 1,
  "name": {
    "fr": "Équerre"
  },
  "icon": "📐",
  "move": {
    "style": "prouesse",
    "tier": 4
  },
  "rarity": "epic",
  "loop": {
    "duration": 3.4,
    "weights": [0.12, 0.2, 0.2, 0.18, 0.14, 0.16],
    "ease": true
  },
  "flags": {
    "expression": "angry"
  },
  "sound": [
    {
      "at": 0.05,
      "accent": "whoosh"
    },
    {
      "at": 0.12,
      "accent": "hold"
    },
    {
      "at": 0.84,
      "accent": "impact"
    }
  ],
  "hands": [
    ["fist", "in"],
    ["fist", "in"]
  ],
  "frames": [
    {
      "joints": {
        "head": [-9, -77.7],
        "neck": [-12, -60],
        "hip": [12, -14],
        "le": [-6.5, -34.6],
        "lh": [0, -9],
        "re": [-6.5, -34.6],
        "rh": [0, -9],
        "lk": [51.8, -11.2],
        "lf": [91.7, -8.4],
        "rk": [51.8, -11.2],
        "rf": [91.7, -8.4]
      },
      "z": {
        "lk": 3,
        "lf": 3,
        "rk": -3,
        "rf": -3
      }
    },
    {
      "joints": {
        "head": [-8, -81.5],
        "neck": [-12, -64],
        "hip": [12, -18],
        "le": [-6.9, -38.5],
        "lh": [0, -9],
        "re": [-6.9, -38.5],
        "rh": [0, -9],
        "lk": [51.4, -24.2],
        "lf": [90.9, -30.5],
        "rk": [51.4, -24.2],
        "rf": [90.9, -30.5]
      },
      "z": {
        "lk": 3,
        "lf": 3,
        "rk": -3,
        "rf": -3
      }
    },
    {
      "joints": {
        "head": [-7.5, -81.8],
        "neck": [-12, -64.4],
        "hip": [12, -18.6],
        "le": [-7.0, -38.9],
        "lh": [0, -9],
        "re": [-7.0, -38.9],
        "rh": [0, -9],
        "lk": [51.5, -24.3],
        "lf": [91.1, -28.8],
        "rk": [51.5, -24.3],
        "rf": [91.1, -28.8]
      },
      "z": {
        "lk": 3,
        "lf": 3,
        "rk": -3,
        "rf": -3
      }
    },
    {
      "joints": {
        "head": [-8.4, -81.4],
        "neck": [-12, -63.8],
        "hip": [12, -17.6],
        "le": [-6.9, -38.3],
        "lh": [0, -9],
        "re": [-6.9, -38.3],
        "rh": [0, -9],
        "lk": [51.3, -24.4],
        "lf": [90.7, -32.4],
        "rk": [51.3, -24.4],
        "rf": [90.7, -32.4]
      },
      "z": {
        "lk": 3,
        "lf": 3,
        "rk": -3,
        "rf": -3
      }
    },
    {
      "joints": {
        "head": [-8, -81.5],
        "neck": [-12, -64],
        "hip": [12, -18],
        "le": [-6.9, -38.5],
        "lh": [0, -9],
        "re": [-6.9, -38.5],
        "rh": [0, -9],
        "lk": [51.4, -24.2],
        "lf": [90.9, -30.5],
        "rk": [51.4, -24.2],
        "rf": [90.9, -30.5]
      },
      "z": {
        "lk": 3,
        "lf": 3,
        "rk": -3,
        "rf": -3
      }
    },
    {
      "joints": {
        "head": [-9, -77.7],
        "neck": [-12, -60],
        "hip": [12, -14],
        "le": [-6.5, -34.6],
        "lh": [0, -9],
        "re": [-6.5, -34.6],
        "rh": [0, -9],
        "lk": [51.8, -11.2],
        "lf": [91.7, -8.4],
        "rk": [51.8, -11.2],
        "rf": [91.7, -8.4]
      },
      "z": {
        "lk": 3,
        "lf": 3,
        "rk": -3,
        "rf": -3
      }
    }
  ]
}
