{
  "id": "anim.provoc.t1.tpose",
  "version": 1,
  "name": {
    "fr": "T-pose"
  },
  "icon": "🛩️",
  "move": {
    "style": "provoc",
    "tier": 1
  },
  "rarity": "common",
  "loop": {
    "duration": 3.8,
    "weights": [0.3, 0.2, 0.3, 0.2],
    "ease": true
  },
  "flags": {
    "expression": "neutral"
  },
  "sound": [
    {
      "at": 0.32,
      "accent": "hold"
    }
  ],
  "hands": [
    ["open", "down"],
    ["open", "down"]
  ],
  "frames": [
    {
      "joints": {
        "head": [0, -150],
        "neck": [0, -132],
        "hip": [0, -80],
        "le": [0, -132],
        "lh": [0, -132],
        "re": [0, -132],
        "rh": [0, -132],
        "lk": [-3, -40],
        "lf": [-3, 0],
        "rk": [3, -40],
        "rf": [3, 0]
      },
      "z": {
        "le": -22,
        "lh": -46,
        "re": 22,
        "rh": 46
      },
      "lift": -6
    },
    {
      "joints": {
        "head": [1, -151],
        "neck": [0, -132],
        "hip": [0, -80],
        "le": [0, -133],
        "lh": [0, -133],
        "re": [0, -133],
        "rh": [0, -133],
        "lk": [-3, -40],
        "lf": [-3, -1],
        "rk": [3, -40],
        "rf": [3, -1]
      },
      "z": {
        "le": -22,
        "lh": -46,
        "re": 22,
        "rh": 46
      },
      "lift": -13,
      "rot": 0.6,
      "hy": -0.3
    },
    {
      "joints": {
        "head": [0, -150],
        "neck": [0, -132],
        "hip": [0, -80],
        "le": [0, -132],
        "lh": [0, -132],
        "re": [0, -132],
        "rh": [0, -132],
        "lk": [-3, -40],
        "lf": [-3, 0],
        "rk": [3, -40],
        "rf": [3, 0]
      },
      "z": {
        "le": -22,
        "lh": -46,
        "re": 22,
        "rh": 46
      },
      "lift": -6
    },
    {
      "joints": {
        "head": [1, -151],
        "neck": [0, -132],
        "hip": [0, -80],
        "le": [0, -133],
        "lh": [0, -133],
        "re": [0, -133],
        "rh": [0, -133],
        "lk": [-3, -40],
        "lf": [-3, -1],
        "rk": [3, -40],
        "rf": [3, -1]
      },
      "z": {
        "le": -22,
        "lh": -46,
        "re": 22,
        "rh": 46
      },
      "lift": -13,
      "rot": -0.6,
      "hy": 0.3
    }
  ]
}
