{
  "id": "anim.acrobatie.t3.aerialspin",
  "version": 1,
  "name": {
    "fr": "Vrille"
  },
  "icon": "🌬️",
  "move": {
    "style": "acrobatie",
    "tier": 3
  },
  "rarity": "rare",
  "loop": {
    "duration": 1.4,
    "weights": [0.24, 0.14, 0.16, 0.14, 0.32],
    "ease": true
  },
  "flags": {
    "expression": "neutral"
  },
  "sound": [
    {
      "at": 0.34,
      "accent": "whoosh"
    },
    {
      "at": 0.68,
      "accent": "impact"
    }
  ],
  "hands": [
    ["fist", "in"],
    ["fist", "in"]
  ],
  "frames": [
    {
      "joints": {
        "head": [5, -137],
        "neck": [3, -120],
        "hip": [-4, -70],
        "le": [10, -106],
        "lh": [30, -104],
        "re": [10, -106],
        "rh": [30, -104],
        "lk": [12, -38],
        "lf": [0, 0],
        "rk": [14, -38],
        "rf": [4, 0]
      },
      "z": {
        "le": -18,
        "lh": -30,
        "re": 18,
        "rh": 30,
        "lk": -4,
        "lf": -6,
        "rk": 4,
        "rf": 6
      },
      "lift": 0,
      "rot": -0.35
    },
    {
      "joints": {
        "head": [0, -155],
        "neck": [0, -137],
        "hip": [0, -85],
        "le": [4, -114],
        "lh": [14, -128],
        "re": [4, -114],
        "rh": [16, -126],
        "lk": [0, -45],
        "lf": [-1, -5],
        "rk": [2, -45],
        "rf": [2, -5]
      },
      "z": {
        "le": -12,
        "lh": 6,
        "re": 12,
        "rh": -6,
        "lk": -2,
        "lf": -2,
        "rk": 2,
        "rf": 2
      },
      "lift": -30,
      "rot": 0.9,
      "hy": -0.4
    },
    {
      "joints": {
        "head": [0, -156],
        "neck": [0, -138],
        "hip": [0, -86],
        "le": [4, -116],
        "lh": [14, -130],
        "re": [4, -116],
        "rh": [16, -128],
        "lk": [0, -46],
        "lf": [-1, -6],
        "rk": [2, -46],
        "rf": [2, -6]
      },
      "z": {
        "le": -12,
        "lh": 6,
        "re": 12,
        "rh": -6,
        "lk": -2,
        "lf": -2,
        "rk": 2,
        "rf": 2
      },
      "lift": -46,
      "rot": 2.9
    },
    {
      "joints": {
        "head": [0, -155],
        "neck": [0, -137],
        "hip": [0, -85],
        "le": [4, -114],
        "lh": [14, -128],
        "re": [4, -114],
        "rh": [16, -126],
        "lk": [0, -45],
        "lf": [-1, -5],
        "rk": [2, -45],
        "rf": [2, -5]
      },
      "z": {
        "le": -12,
        "lh": 6,
        "re": 12,
        "rh": -6,
        "lk": -2,
        "lf": -2,
        "rk": 2,
        "rf": 2
      },
      "lift": -26,
      "rot": 5,
      "hy": 0.4
    },
    {
      "joints": {
        "head": [4, -136],
        "neck": [2, -119],
        "hip": [-4, -70],
        "le": [4, -112],
        "lh": [10, -116],
        "re": [4, -112],
        "rh": [10, -116],
        "lk": [12, -38],
        "lf": [0, 0],
        "rk": [14, -38],
        "rf": [4, 0]
      },
      "z": {
        "le": -24,
        "lh": -47,
        "re": 24,
        "rh": 47,
        "lk": -5,
        "lf": -6,
        "rk": 5,
        "rf": 6
      },
      "lift": 0,
      "rot": 6.283185307179586
    }
  ]
}
