{
  "id": "anim.hype.t0.dab",
  "version": 1,
  "name": {
    "fr": "Dab"
  },
  "icon": "🤙",
  "move": {
    "style": "hype",
    "tier": 0
  },
  "rarity": "default",
  "loop": {
    "duration": 1.9,
    "weights": [0.16, 0.62, 0.22],
    "ease": true
  },
  "flags": {
    "expression": "neutral"
  },
  "hands": [
    ["open", "down"],
    ["open", "down"]
  ],
  "frames": [
    {
      "joints": {
        "head": [0, -150],
        "neck": [0, -132],
        "hip": [0, -80],
        "le": [-12, -106],
        "lh": [-10, -82],
        "re": [12, -106],
        "rh": [14, -82],
        "lk": [-8, -40],
        "lf": [-12, 0],
        "rk": [8, -40],
        "rf": [12, 0]
      },
      "hy": -0.1
    },
    {
      "joints": {
        "head": [9, -143],
        "neck": [3, -131],
        "hip": [0, -80],
        "le": [-26, -144],
        "lh": [-52, -160],
        "re": [17, -148],
        "rh": [-4, -166],
        "lk": [-8, -40],
        "lf": [-12, 0],
        "rk": [8, -40],
        "rf": [12, 0]
      },
      "rot": 0.25
    },
    {
      "joints": {
        "head": [10, -142],
        "neck": [3, -131],
        "hip": [0, -80],
        "le": [-26, -146],
        "lh": [-53, -162],
        "re": [17, -149],
        "rh": [-4, -168],
        "lk": [-8, -40],
        "lf": [-12, 0],
        "rk": [8, -40],
        "rf": [12, 0]
      },
      "rot": 0.22
    }
  ]
}
