{
  "id": "anim.acrobatie.t2.splitleap",
  "version": 1,
  "name": {
    "fr": "Grand écart sauté"
  },
  "icon": "✂️",
  "move": {
    "style": "acrobatie",
    "tier": 2
  },
  "rarity": "rare",
  "loop": {
    "duration": 1.6,
    "weights": [0.22, 0.16, 0.18, 0.12, 0.32],
    "ease": true
  },
  "flags": {
    "expression": "smug"
  },
  "sound": [
    {
      "at": 0.3,
      "accent": "whoosh"
    },
    {
      "at": 0.68,
      "accent": "impact"
    }
  ],
  "hands": [
    ["open", "down"],
    ["open", "down"]
  ],
  "frames": [
    {
      "joints": {
        "head": [4, -138],
        "neck": [2, -121],
        "hip": [-2, -70],
        "le": [-10, -98],
        "lh": [-20, -78],
        "re": [8, -98],
        "rh": [16, -78],
        "lk": [-14, -36],
        "lf": [-30, -4],
        "rk": [16, -38],
        "rf": [18, -2]
      },
      "lift": 0
    },
    {
      "joints": {
        "head": [3, -154],
        "neck": [2, -136],
        "hip": [0, -84],
        "le": [-4, -152],
        "lh": [-8, -168],
        "re": [16, -156],
        "rh": [34, -170],
        "lk": [-12, -46],
        "lf": [-24, -8],
        "rk": [26, -54],
        "rf": [52, -24]
      },
      "z": {
        "le": -16,
        "lh": -32
      },
      "lift": -20
    },
    {
      "joints": {
        "head": [0, -156],
        "neck": [0, -138],
        "hip": [0, -86],
        "le": [0, -144],
        "lh": [-2, -152],
        "re": [22, -150],
        "rh": [44, -160],
        "lk": [-39, -94],
        "lf": [-79, -98],
        "rk": [39, -94],
        "rf": [79, -100]
      },
      "z": {
        "le": -25,
        "lh": -48
      },
      "lift": -46
    },
    {
      "joints": {
        "head": [0, -154],
        "neck": [0, -136],
        "hip": [0, -84],
        "le": [0, -140],
        "lh": [-4, -142],
        "re": [22, -146],
        "rh": [44, -152],
        "lk": [-36, -66],
        "lf": [-72, -80],
        "rk": [20, -50],
        "rf": [26, -11]
      },
      "z": {
        "le": -25,
        "lh": -48
      },
      "lift": -12
    },
    {
      "joints": {
        "head": [9, -136],
        "neck": [6, -120],
        "hip": [2, -70],
        "le": [-4, -100],
        "lh": [-10, -80],
        "re": [18, -100],
        "rh": [30, -80],
        "lk": [-18, -44],
        "lf": [-40, -14],
        "rk": [22, -38],
        "rf": [24, -2]
      },
      "z": {
        "le": -12,
        "lh": -16
      },
      "lift": 0
    }
  ]
}
