{
  "id": "anim.acrobatie.t1.tuckjump",
  "version": 1,
  "name": {
    "fr": "Saut groupé"
  },
  "icon": "🦘",
  "move": {
    "style": "acrobatie",
    "tier": 1
  },
  "rarity": "common",
  "loop": {
    "duration": 1.3,
    "weights": [0.2, 0.14, 0.14, 0.14, 0.38],
    "ease": true
  },
  "flags": {
    "expression": "neutral"
  },
  "sound": [
    {
      "at": 0.2,
      "accent": "whoosh"
    },
    {
      "at": 0.62,
      "accent": "impact"
    }
  ],
  "hands": [
    ["fist", "in"],
    ["fist", "in"]
  ],
  "frames": [
    {
      "joints": {
        "head": [5, -137],
        "neck": [3, -120],
        "hip": [-4, -70],
        "le": [-12, -99],
        "lh": [-30, -86],
        "re": [-9, -99],
        "rh": [-26, -86],
        "lk": [12, -38],
        "lf": [0, 0],
        "rk": [14, -38],
        "rf": [4, 0]
      },
      "lift": 0
    },
    {
      "joints": {
        "head": [0, -156],
        "neck": [0, -138],
        "hip": [0, -86],
        "le": [4, -162],
        "lh": [6, -186],
        "re": [8, -161],
        "rh": [12, -184],
        "lk": [0, -46],
        "lf": [-2, -6],
        "rk": [2, -46],
        "rf": [2, -6]
      },
      "lift": -30
    },
    {
      "joints": {
        "head": [9, -146],
        "neck": [4, -130],
        "hip": [-2, -82],
        "le": [10, -116],
        "lh": [26, -96],
        "re": [10, -116],
        "rh": [26, -96],
        "lk": [24, -108],
        "lf": [12, -70],
        "rk": [26, -110],
        "rf": [14, -72]
      },
      "z": {
        "le": -18,
        "lh": -12,
        "re": 18,
        "rh": 12,
        "lk": -7,
        "lf": -7,
        "rk": 7,
        "rf": 7
      },
      "lift": -48
    },
    {
      "joints": {
        "head": [0, -154],
        "neck": [0, -136],
        "hip": [0, -84],
        "le": [20, -150],
        "lh": [42, -158],
        "re": [20, -150],
        "rh": [42, -158],
        "lk": [2, -44],
        "lf": [0, -4],
        "rk": [4, -44],
        "rf": [4, -4]
      },
      "lift": -22
    },
    {
      "joints": {
        "head": [6, -132],
        "neck": [4, -116],
        "hip": [-6, -66],
        "le": [28, -112],
        "lh": [50, -106],
        "re": [28, -114],
        "rh": [52, -110],
        "lk": [14, -34],
        "lf": [0, 0],
        "rk": [16, -34],
        "rf": [4, 0]
      },
      "lift": 0
    }
  ]
}
