{
  "id": "anim.acrobatie.t1.roll",
  "version": 1,
  "name": {
    "fr": "Roulade"
  },
  "icon": "🌀",
  "move": {
    "style": "acrobatie",
    "tier": 1
  },
  "rarity": "default",
  "loop": {
    "duration": 2.8,
    "weights": [
      0.18,
      0.1,
      0.07,
      0.07,
      0.07,
      0.07,
      0.07,
      0.12,
      0.25
    ],
    "ease": true
  },
  "flags": {
    "expression": "joy"
  },
  "sound": [
    {
      "at": 0.3,
      "accent": "whoosh"
    },
    {
      "at": 0.62,
      "accent": "impact"
    }
  ],
  "hands": [
    [
      "open",
      "up"
    ],
    [
      "open",
      "up"
    ]
  ],
  "frames": [
    {
      "joints": {
        "head": [
          0,
          -150
        ],
        "neck": [
          0,
          -132
        ],
        "hip": [
          0,
          -80
        ],
        "le": [
          -22,
          -146
        ],
        "lh": [
          -40,
          -162
        ],
        "re": [
          22,
          -146
        ],
        "rh": [
          40,
          -162
        ],
        "lk": [
          -10,
          -40
        ],
        "lf": [
          -16,
          0
        ],
        "rk": [
          10,
          -40
        ],
        "rf": [
          16,
          0
        ]
      }
    },
    {
      "joints": {
        "head": [
          -10,
          -100
        ],
        "neck": [
          -6,
          -84
        ],
        "hip": [
          8,
          -36
        ],
        "le": [
          -26,
          -70
        ],
        "lh": [
          -48,
          -60
        ],
        "re": [
          -26,
          -70
        ],
        "rh": [
          -48,
          -60
        ],
        "lk": [
          -30,
          -32
        ],
        "lf": [
          0,
          -2
        ],
        "rk": [
          -30,
          -32
        ],
        "rf": [
          0,
          -2
        ]
      },
      "z": {
        "le": -10,
        "lh": -11,
        "re": 10,
        "rh": 11,
        "lk": -6,
        "lf": -7,
        "rk": 6,
        "rf": 7
      }
    },
    {
      "joints": {
        "head": [
          -24.0,
          -57.0
        ],
        "neck": [
          -14.0,
          -71.0
        ],
        "hip": [
          14.0,
          -27.0
        ],
        "le": [
          -30.0,
          -51.0
        ],
        "lh": [
          -10.0,
          -35.0
        ],
        "re": [
          -30.0,
          -51.0
        ],
        "rh": [
          -10.0,
          -35.0
        ],
        "lk": [
          -24.0,
          -43.0
        ],
        "lf": [
          10.0,
          -15.0
        ],
        "rk": [
          -24.0,
          -43.0
        ],
        "rf": [
          10.0,
          -15.0
        ]
      },
      "z": {
        "le": -10,
        "lh": -11,
        "re": 10,
        "rh": 11,
        "lk": -6,
        "lf": -7,
        "rk": 6,
        "rf": 7
      }
    },
    {
      "joints": {
        "head": [
          -10.0,
          -23.0
        ],
        "neck": [
          -24.0,
          -33.0
        ],
        "hip": [
          20.0,
          -61.0
        ],
        "le": [
          -4.0,
          -17.0
        ],
        "lh": [
          12.0,
          -37.0
        ],
        "re": [
          -4.0,
          -17.0
        ],
        "rh": [
          12.0,
          -37.0
        ],
        "lk": [
          4.0,
          -23.0
        ],
        "lf": [
          32.0,
          -57.0
        ],
        "rk": [
          4.0,
          -23.0
        ],
        "rf": [
          32.0,
          -57.0
        ]
      },
      "z": {
        "le": -10,
        "lh": -11,
        "re": 10,
        "rh": 11,
        "lk": -6,
        "lf": -7,
        "rk": 6,
        "rf": 7
      }
    },
    {
      "joints": {
        "head": [
          24.0,
          -37.0
        ],
        "neck": [
          14.0,
          -23.0
        ],
        "hip": [
          -14.0,
          -67.0
        ],
        "le": [
          30.0,
          -43.0
        ],
        "lh": [
          10.0,
          -59.0
        ],
        "re": [
          30.0,
          -43.0
        ],
        "rh": [
          10.0,
          -59.0
        ],
        "lk": [
          24.0,
          -51.0
        ],
        "lf": [
          -10.0,
          -79.0
        ],
        "rk": [
          24.0,
          -51.0
        ],
        "rf": [
          -10.0,
          -79.0
        ]
      },
      "z": {
        "le": -10,
        "lh": -11,
        "re": 10,
        "rh": 11,
        "lk": -6,
        "lf": -7,
        "rk": 6,
        "rf": 7
      }
    },
    {
      "joints": {
        "head": [
          10.0,
          -71.0
        ],
        "neck": [
          24.0,
          -61.0
        ],
        "hip": [
          -20.0,
          -33.0
        ],
        "le": [
          4.0,
          -77.0
        ],
        "lh": [
          -12.0,
          -57.0
        ],
        "re": [
          4.0,
          -77.0
        ],
        "rh": [
          -12.0,
          -57.0
        ],
        "lk": [
          -4.0,
          -71.0
        ],
        "lf": [
          -32.0,
          -37.0
        ],
        "rk": [
          -4.0,
          -71.0
        ],
        "rf": [
          -32.0,
          -37.0
        ]
      },
      "z": {
        "le": -10,
        "lh": -11,
        "re": 10,
        "rh": 11,
        "lk": -6,
        "lf": -7,
        "rk": 6,
        "rf": 7
      }
    },
    {
      "joints": {
        "head": [
          -24.0,
          -57.0
        ],
        "neck": [
          -14.0,
          -71.0
        ],
        "hip": [
          14.0,
          -27.0
        ],
        "le": [
          -30.0,
          -51.0
        ],
        "lh": [
          -10.0,
          -35.0
        ],
        "re": [
          -30.0,
          -51.0
        ],
        "rh": [
          -10.0,
          -35.0
        ],
        "lk": [
          -24.0,
          -43.0
        ],
        "lf": [
          10.0,
          -15.0
        ],
        "rk": [
          -24.0,
          -43.0
        ],
        "rf": [
          10.0,
          -15.0
        ]
      },
      "z": {
        "le": -10,
        "lh": -11,
        "re": 10,
        "rh": 11,
        "lk": -6,
        "lf": -7,
        "rk": 6,
        "rf": 7
      }
    },
    {
      "joints": {
        "head": [
          -10,
          -100
        ],
        "neck": [
          -6,
          -84
        ],
        "hip": [
          8,
          -36
        ],
        "le": [
          -26,
          -70
        ],
        "lh": [
          -48,
          -60
        ],
        "re": [
          -26,
          -70
        ],
        "rh": [
          -48,
          -60
        ],
        "lk": [
          -30,
          -32
        ],
        "lf": [
          0,
          -2
        ],
        "rk": [
          -30,
          -32
        ],
        "rf": [
          0,
          -2
        ]
      },
      "z": {
        "le": -10,
        "lh": -11,
        "re": 10,
        "rh": 11,
        "lk": -6,
        "lf": -7,
        "rk": 6,
        "rf": 7
      }
    },
    {
      "joints": {
        "head": [
          0,
          -150
        ],
        "neck": [
          0,
          -132
        ],
        "hip": [
          0,
          -80
        ],
        "le": [
          -22,
          -146
        ],
        "lh": [
          -40,
          -162
        ],
        "re": [
          22,
          -146
        ],
        "rh": [
          40,
          -162
        ],
        "lk": [
          -10,
          -40
        ],
        "lf": [
          -16,
          0
        ],
        "rk": [
          10,
          -40
        ],
        "rf": [
          16,
          0
        ]
      }
    }
  ]
}
