{
  "id": "anim.prouesse.t0.squats",
  "version": 1,
  "name": {
    "fr": "Squats"
  },
  "icon": "🦵",
  "move": {
    "style": "prouesse",
    "tier": 0
  },
  "rarity": "common",
  "loop": {
    "duration": 2.2,
    "weights": [0.26, 0.36, 0.16, 0.22],
    "ease": true
  },
  "flags": {
    "expression": "smug"
  },
  "sound": [
    {
      "at": 0.62,
      "accent": "hold"
    },
    {
      "at": 0.88,
      "accent": "whoosh"
    }
  ],
  "hands": [
    ["open", "down"],
    ["open", "down"]
  ],
  "frames": [
    {
      "joints": {
        "head": [1.8, -147.5],
        "neck": [1.8, -129.5],
        "hip": [0, -77.5],
        "le": [27.8, -127.7],
        "lh": [51.7, -126.0],
        "re": [27.8, -127.7],
        "rh": [51.7, -126.0],
        "lk": [6.7, -39.1],
        "lf": [2, 0],
        "rk": [6.7, -39.1],
        "rf": [2, 0]
      },
      "z": {
        "lk": -9,
        "lf": -16,
        "rk": 9,
        "rf": 16
      }
    },
    {
      "joints": {
        "head": [3.3, -147.4],
        "neck": [2.7, -129.4],
        "hip": [0, -77.5],
        "le": [28.7, -128.5],
        "lh": [52.7, -127.7],
        "re": [28.7, -128.5],
        "rh": [52.7, -127.7],
        "lk": [6.7, -39.1],
        "lf": [2, 0],
        "rk": [6.7, -39.1],
        "rf": [2, 0]
      },
      "z": {
        "lk": -9,
        "lf": -16,
        "rk": 9,
        "rf": 16
      }
    },
    {
      "joints": {
        "head": [24.1, -97.8],
        "neck": [17.4, -81.1],
        "hip": [-20, -45],
        "le": [43.4, -81.1],
        "lh": [67.4, -81.1],
        "re": [43.4, -81.1],
        "rh": [67.4, -81.1],
        "lk": [15.0, -37.8],
        "lf": [2, 0],
        "rk": [15.0, -37.8],
        "rf": [2, 0]
      },
      "z": {
        "lk": -18,
        "lf": -16,
        "rk": 18,
        "rf": 16
      }
    },
    {
      "joints": {
        "head": [23.3, -100.3],
        "neck": [17.1, -83.4],
        "hip": [-19, -46],
        "le": [43.1, -83.9],
        "lh": [67.1, -84.3],
        "re": [43.1, -83.9],
        "rh": [67.1, -84.3],
        "lk": [15.7, -37.5],
        "lf": [2, 0],
        "rk": [15.7, -37.5],
        "rf": [2, 0]
      },
      "z": {
        "lk": -18,
        "lf": -16,
        "rk": 18,
        "rf": 16
      }
    }
  ]
}
