{
  "id": "anim.provoc.t2.shrug",
  "version": 1,
  "name": {
    "fr": "Haussement d'épaules"
  },
  "icon": "🤷",
  "move": {
    "style": "provoc",
    "tier": 2
  },
  "rarity": "rare",
  "loop": {
    "duration": 2,
    "weights": [0.2, 0.45, 0.35],
    "ease": true
  },
  "flags": {
    "expression": "smug"
  },
  "hands": [
    ["open", "up"],
    ["open", "up"]
  ],
  "frames": [
    {
      "joints": {
        "head": [0, -150],
        "neck": [0, -132],
        "hip": [0, -80],
        "le": [-12, -106],
        "lh": [-8, -82],
        "re": [12, -106],
        "rh": [10, -82],
        "lk": [-8, -40],
        "lf": [-12, 0],
        "rk": [8, -40],
        "rf": [12, 0]
      },
      "hy": -0.1
    },
    {
      "joints": {
        "head": [-3, -146],
        "neck": [0, -130],
        "hip": [0, -80],
        "le": [-6, -110],
        "lh": [12, -100],
        "re": [8, -110],
        "rh": [16, -100],
        "lk": [-8, -40],
        "lf": [-12, 0],
        "rk": [8, -40],
        "rf": [12, 0]
      },
      "z": {
        "le": -14,
        "lh": -30,
        "re": 14,
        "rh": 30
      },
      "rot": 0.1,
      "hy": -0.4
    },
    {
      "joints": {
        "head": [-3, -147],
        "neck": [0, -130],
        "hip": [0, -80],
        "le": [-6, -111],
        "lh": [12, -101],
        "re": [8, -111],
        "rh": [16, -101],
        "lk": [-8, -40],
        "lf": [-12, 0],
        "rk": [8, -40],
        "rf": [12, 0]
      },
      "z": {
        "le": -14,
        "lh": -30,
        "re": 14,
        "rh": 30
      },
      "rot": 0.08,
      "hy": -0.3
    }
  ]
}
