{
  "id": "anim.acrobatie.t0.starjump",
  "version": 1,
  "name": {
    "fr": "Saut étoile"
  },
  "icon": "⭐",
  "move": {
    "style": "acrobatie",
    "tier": 0
  },
  "rarity": "common",
  "loop": {
    "duration": 1.2,
    "weights": [0.3, 0.24, 0.46],
    "ease": true
  },
  "flags": {
    "expression": "joy"
  },
  "sound": [
    {
      "at": 0.14,
      "accent": "whoosh"
    },
    {
      "at": 0.54,
      "accent": "impact"
    }
  ],
  "hands": [
    ["open", "fwd"],
    ["open", "fwd"]
  ],
  "frames": [
    {
      "joints": {
        "head": [4, -138],
        "neck": [2, -121],
        "hip": [-2, -70],
        "le": [-8, -97],
        "lh": [-16, -75],
        "re": [-4, -97],
        "rh": [-10, -74],
        "lk": [12, -38],
        "lf": [-2, 0],
        "rk": [14, -38],
        "rf": [2, 0]
      },
      "z": {
        "lk": -6,
        "lf": -8,
        "rk": 6,
        "rf": 8
      },
      "lift": 0
    },
    {
      "joints": {
        "head": [0, -154],
        "neck": [0, -136],
        "hip": [0, -84],
        "le": [0, -150],
        "lh": [2, -164],
        "re": [0, -150],
        "rh": [2, -164],
        "lk": [2, -48],
        "lf": [2, -12],
        "rk": [2, -48],
        "rf": [2, -12]
      },
      "z": {
        "le": -22,
        "lh": -42,
        "re": 22,
        "rh": 42,
        "lk": -17,
        "lf": -34,
        "rk": 17,
        "rf": 34
      },
      "lift": -40
    },
    {
      "joints": {
        "head": [3, -140],
        "neck": [1, -123],
        "hip": [-2, -72],
        "le": [-2, -108],
        "lh": [-4, -88],
        "re": [-2, -108],
        "rh": [-4, -88],
        "lk": [10, -38],
        "lf": [-1, -2],
        "rk": [12, -38],
        "rf": [3, -2]
      },
      "z": {
        "le": -20,
        "lh": -28,
        "re": 20,
        "rh": 28,
        "lk": -8,
        "lf": -8,
        "rk": 8,
        "rf": 8
      },
      "lift": -2
    }
  ]
}
