{
  "id": "anim.prouesse.t1.pushups",
  "version": 1,
  "name": {
    "fr": "Pompes"
  },
  "icon": "🏋️",
  "move": {
    "style": "prouesse",
    "tier": 1
  },
  "rarity": "default",
  "loop": {
    "duration": 2.4,
    "weights": [
      0.16,
      0.16,
      0.16,
      0.16,
      0.36
    ],
    "ease": true
  },
  "flags": {
    "expression": "angry"
  },
  "sound": [
    {
      "at": 0.16,
      "accent": "impact"
    },
    {
      "at": 0.48,
      "accent": "impact"
    }
  ],
  "hands": [
    [
      "fist",
      "in"
    ],
    [
      "fist",
      "in"
    ]
  ],
  "frames": [
    {
      "joints": {
        "head": [
          -57.2,
          -67.6
        ],
        "neck": [
          -42,
          -58
        ],
        "hip": [
          6.9,
          -40.3
        ],
        "le": [
          -38.2,
          -32.3
        ],
        "lh": [
          -44,
          -9
        ],
        "re": [
          -38.2,
          -32.3
        ],
        "rh": [
          -44,
          -9
        ],
        "lk": [
          45.5,
          -26.4
        ],
        "lf": [
          83.1,
          -12.8
        ],
        "rk": [
          45.5,
          -26.4
        ],
        "rf": [
          83.1,
          -12.8
        ]
      },
      "z": {
        "le": -12,
        "lh": -13,
        "re": 12,
        "rh": 13,
        "lk": -7,
        "lf": -8,
        "rk": 7,
        "rf": 8
      }
    },
    {
      "joints": {
        "head": [
          -58.8,
          -35.6
        ],
        "neck": [
          -42,
          -29
        ],
        "hip": [
          9.5,
          -21.9
        ],
        "le": [
          -20.6,
          -14.3
        ],
        "lh": [
          -44,
          -9
        ],
        "re": [
          -20.6,
          -14.3
        ],
        "rh": [
          -44,
          -9
        ],
        "lk": [
          50.1,
          -16.2
        ],
        "lf": [
          89.7,
          -10.8
        ],
        "rk": [
          50.1,
          -16.2
        ],
        "rf": [
          89.7,
          -10.8
        ]
      },
      "z": {
        "le": -12,
        "lh": -13,
        "re": 12,
        "rh": 13,
        "lk": -7,
        "lf": -8,
        "rk": 7,
        "rf": 8
      }
    },
    {
      "joints": {
        "head": [
          -57.2,
          -67.6
        ],
        "neck": [
          -42,
          -58
        ],
        "hip": [
          6.9,
          -40.3
        ],
        "le": [
          -38.2,
          -32.3
        ],
        "lh": [
          -44,
          -9
        ],
        "re": [
          -38.2,
          -32.3
        ],
        "rh": [
          -44,
          -9
        ],
        "lk": [
          45.5,
          -26.4
        ],
        "lf": [
          83.1,
          -12.8
        ],
        "rk": [
          45.5,
          -26.4
        ],
        "rf": [
          83.1,
          -12.8
        ]
      },
      "z": {
        "le": -12,
        "lh": -13,
        "re": 12,
        "rh": 13,
        "lk": -7,
        "lf": -8,
        "rk": 7,
        "rf": 8
      }
    },
    {
      "joints": {
        "head": [
          -58.8,
          -35.6
        ],
        "neck": [
          -42,
          -29
        ],
        "hip": [
          9.5,
          -21.9
        ],
        "le": [
          -20.6,
          -14.3
        ],
        "lh": [
          -44,
          -9
        ],
        "re": [
          -20.6,
          -14.3
        ],
        "rh": [
          -44,
          -9
        ],
        "lk": [
          50.1,
          -16.2
        ],
        "lf": [
          89.7,
          -10.8
        ],
        "rk": [
          50.1,
          -16.2
        ],
        "rf": [
          89.7,
          -10.8
        ]
      },
      "z": {
        "le": -12,
        "lh": -13,
        "re": 12,
        "rh": 13,
        "lk": -7,
        "lf": -8,
        "rk": 7,
        "rf": 8
      }
    },
    {
      "joints": {
        "head": [
          -54.7,
          -70.7
        ],
        "neck": [
          -42,
          -58
        ],
        "hip": [
          6.9,
          -40.3
        ],
        "le": [
          -38.2,
          -32.3
        ],
        "lh": [
          -44,
          -9
        ],
        "re": [
          -38.2,
          -32.3
        ],
        "rh": [
          -44,
          -9
        ],
        "lk": [
          45.5,
          -26.4
        ],
        "lf": [
          83.1,
          -12.8
        ],
        "rk": [
          45.5,
          -26.4
        ],
        "rf": [
          83.1,
          -12.8
        ]
      },
      "z": {
        "le": -12,
        "lh": -13,
        "re": 12,
        "rh": 13,
        "lk": -7,
        "lf": -8,
        "rk": 7,
        "rf": 8
      }
    }
  ]
}
