{
  "id": "anim.prouesse.t3.handstand",
  "version": 1,
  "name": {
    "fr": "Poirier"
  },
  "icon": "🙃",
  "move": {
    "style": "prouesse",
    "tier": 3
  },
  "rarity": "default",
  "loop": {
    "duration": 3.6,
    "weights": [0.07, 0.07, 0.08, 0.22, 0.2, 0.2, 0.08, 0.08],
    "ease": true
  },
  "flags": {
    "expression": "neutral"
  },
  "sound": [
    {
      "at": 0.12,
      "accent": "whoosh"
    },
    {
      "at": 0.2,
      "accent": "impact"
    },
    {
      "at": 0.86,
      "accent": "impact"
    }
  ],
  "hands": [
    ["open", "fwd"],
    ["open", "fwd"]
  ],
  "frames": [
    {
      "joints": {
        "head": [0, -150],
        "neck": [0, -132],
        "hip": [0, -80],
        "le": [-14, -154],
        "lh": [-18, -178],
        "re": [14, -154],
        "rh": [18, -178],
        "lk": [-10, -40],
        "lf": [-16, 0],
        "rk": [10, -40],
        "rf": [16, 0]
      },
      "pitch": 0,
      "lift": 0
    },
    {
      "joints": {
        "head": [0, -150],
        "neck": [0, -132],
        "hip": [0, -80],
        "le": [-14, -154],
        "lh": [-18, -178],
        "re": [14, -154],
        "rh": [18, -178],
        "lk": [-10, -40],
        "lf": [-16, 0],
        "rk": [10, -40],
        "rf": [16, 0]
      },
      "pitch": 0.47123889803846897,
      "lift": -14
    },
    {
      "joints": {
        "head": [0.0, -150],
        "neck": [0.0, -132],
        "hip": [0, -80],
        "le": [-5, -157],
        "lh": [-7, -181],
        "re": [5, -157],
        "rh": [7, -181],
        "lk": [-3.0, -40],
        "lf": [-4.0, 0],
        "rk": [3.0, -40],
        "rf": [4.0, 0]
      },
      "pitch": 1.5707963267948966,
      "lift": -46
    },
    {
      "joints": {
        "head": [0.0, -150],
        "neck": [0.0, -132],
        "hip": [0, -80],
        "le": [-5, -157],
        "lh": [-7, -181],
        "re": [5, -157],
        "rh": [7, -181],
        "lk": [-3.0, -40],
        "lf": [-4.0, 0],
        "rk": [3.0, -40],
        "rf": [4.0, 0]
      },
      "pitch": 3.141592653589793,
      "lift": -26
    },
    {
      "joints": {
        "head": [2, -150],
        "neck": [1.0, -132],
        "hip": [0, -80],
        "le": [-5, -157],
        "lh": [-7, -181],
        "re": [5, -157],
        "rh": [7, -181],
        "lk": [-11, -40],
        "lf": [-20, 0],
        "rk": [11, -40],
        "rf": [20, 0]
      },
      "pitch": 3.141592653589793,
      "lift": -26
    },
    {
      "joints": {
        "head": [-2, -150],
        "neck": [-1.0, -132],
        "hip": [0, -80],
        "le": [-5, -157],
        "lh": [-7, -181],
        "re": [5, -157],
        "rh": [7, -181],
        "lk": [-3, -40],
        "lf": [-4, 0],
        "rk": [3, -40],
        "rf": [4, 0]
      },
      "pitch": 3.141592653589793,
      "lift": -26
    },
    {
      "joints": {
        "head": [0.0, -150],
        "neck": [0.0, -132],
        "hip": [0, -80],
        "le": [-5, -157],
        "lh": [-7, -181],
        "re": [5, -157],
        "rh": [7, -181],
        "lk": [-3.0, -40],
        "lf": [-4.0, 0],
        "rk": [3.0, -40],
        "rf": [4.0, 0]
      },
      "pitch": 5.026548245743669,
      "lift": -40
    },
    {
      "joints": {
        "head": [0, -150],
        "neck": [0, -132],
        "hip": [0, -80],
        "le": [-14, -154],
        "lh": [-18, -178],
        "re": [14, -154],
        "rh": [18, -178],
        "lk": [-10, -40],
        "lf": [-16, 0],
        "rk": [10, -40],
        "rf": [16, 0]
      },
      "pitch": 6.283185307179586,
      "lift": 0
    }
  ]
}
