{
  "id": "anim.provoc.t4.back",
  "version": 1,
  "name": {
    "fr": "Dos tourné"
  },
  "icon": "🔙",
  "move": {
    "style": "provoc",
    "tier": 4
  },
  "rarity": "default",
  "loop": {
    "duration": 4.6,
    "weights": [0.34, 0.16, 0.34, 0.16],
    "ease": true
  },
  "flags": {
    "expression": "neutral",
    "armsBack": true,
    "noFace": true
  },
  "hands": [
    ["fist", "in"],
    ["fist", "in"]
  ],
  "frames": [
    {
      "joints": {
        "head": [0, -150],
        "neck": [0, -132],
        "hip": [0, -80],
        "le": [-10, -106],
        "lh": [-4, -86],
        "re": [10, -106],
        "rh": [4, -86],
        "lk": [-8, -40],
        "lf": [-12, 0],
        "rk": [8, -40],
        "rf": [12, 0]
      }
    },
    {
      "joints": {
        "head": [0, -150],
        "neck": [0, -132],
        "hip": [0, -80],
        "le": [-10, -106],
        "lh": [-4, -86],
        "re": [10, -106],
        "rh": [4, -86],
        "lk": [-8, -40],
        "lf": [-12, 0],
        "rk": [8, -40],
        "rf": [12, 0]
      }
    },
    {
      "joints": {
        "head": [-2, -150],
        "neck": [0, -132],
        "hip": [0, -80],
        "le": [-10, -106],
        "lh": [-4, -86],
        "re": [10, -106],
        "rh": [4, -86],
        "lk": [-8, -40],
        "lf": [-12, 0],
        "rk": [8, -40],
        "rf": [12, 0]
      },
      "hy": 1.05
    },
    {
      "joints": {
        "head": [-2, -150],
        "neck": [0, -132],
        "hip": [0, -80],
        "le": [-10, -106],
        "lh": [-4, -86],
        "re": [10, -106],
        "rh": [4, -86],
        "lk": [-8, -40],
        "lf": [-12, 0],
        "rk": [8, -40],
        "rf": [12, 0]
      },
      "hy": 1.05
    }
  ]
}
