{
  "id": "anim.acrobatie.t2.wheel",
  "version": 1,
  "name": {
    "fr": "Roue"
  },
  "move": {
    "style": "acrobatie",
    "tier": 2
  },
  "rarity": "default",
  "loop": {
    "duration": 2.4,
    "weights": [0.22, 0.13, 0.18, 0.13, 0.1, 0.24],
    "ease": true
  },
  "flags": {
    "expression": "neutral"
  },
  "sound": [
    {
      "at": 0.3,
      "accent": "whoosh"
    },
    {
      "at": 0.66,
      "accent": "impact"
    }
  ],
  "hands": [
    ["open", "down"],
    ["open", "down"]
  ],
  "frames": [
    {
      "joints": {
        "head": [0, -150],
        "neck": [0, -132],
        "hip": [0, -80],
        "le": [-12, -152],
        "lh": [-16, -176],
        "re": [12, -152],
        "rh": [16, -176],
        "lk": [-7, -40],
        "lf": [-10, 0],
        "rk": [8, -40],
        "rf": [11, 0]
      },
      "lift": 0,
      "pitch": 0
    },
    {
      "joints": {
        "head": [0, -152],
        "neck": [0, -134],
        "hip": [0, -82],
        "le": [-8, -156],
        "lh": [-10, -180],
        "re": [8, -156],
        "rh": [10, -180],
        "lk": [-16, -46],
        "lf": [-32, -8],
        "rk": [14, -46],
        "rf": [30, -10]
      },
      "lift": -16,
      "pitch": -0.9
    },
    {
      "joints": {
        "head": [0, -152],
        "neck": [0, -134],
        "hip": [0, -82],
        "le": [-4, -160],
        "lh": [-6, -184],
        "re": [4, -160],
        "rh": [6, -184],
        "lk": [-26, -52],
        "lf": [-52, -24],
        "rk": [26, -52],
        "rf": [52, -24]
      },
      "lift": -28,
      "pitch": -3
    },
    {
      "joints": {
        "head": [0, -152],
        "neck": [0, -134],
        "hip": [0, -82],
        "le": [-8, -156],
        "lh": [-10, -180],
        "re": [8, -156],
        "rh": [10, -180],
        "lk": [14, -46],
        "lf": [30, -10],
        "rk": [-16, -46],
        "rf": [-32, -8]
      },
      "lift": -16,
      "pitch": -5
    },
    {
      "joints": {
        "head": [0, -150],
        "neck": [0, -132],
        "hip": [0, -80],
        "le": [-10, -150],
        "lh": [-14, -174],
        "re": [10, -150],
        "rh": [14, -174],
        "lk": [-14, -42],
        "lf": [-24, -4],
        "rk": [10, -40],
        "rf": [16, 0]
      },
      "lift": -2,
      "pitch": -5.9
    },
    {
      "joints": {
        "head": [0, -149],
        "neck": [0, -131],
        "hip": [0, -79],
        "le": [-12, -148],
        "lh": [-16, -172],
        "re": [12, -148],
        "rh": [16, -172],
        "lk": [-7, -39],
        "lf": [-9, 0],
        "rk": [8, -39],
        "rf": [11, 0]
      },
      "lift": 0,
      "pitch": -6.283185307179586
    }
  ]
}
