{
  "id": "anim.provoc.t3.dust",
  "version": 1,
  "name": {
    "fr": "Épaules époussetées"
  },
  "icon": "🧹",
  "move": {
    "style": "provoc",
    "tier": 3
  },
  "rarity": "epic",
  "framing": {
    "shot": "bust"
  },
  "loop": {
    "duration": 1.8,
    "weights": [0.3, 0.2, 0.3, 0.2],
    "ease": true
  },
  "flags": {
    "expression": "smug"
  },
  "sound": [
    {
      "at": 0.36,
      "accent": "whoosh"
    },
    {
      "at": 0.86,
      "accent": "whoosh"
    }
  ],
  "hands": [
    ["open", "down"],
    ["open", "down"]
  ],
  "frames": [
    {
      "joints": {
        "head": [-2, -149],
        "neck": [0, -131],
        "hip": [0, -80],
        "le": [-14, -108],
        "lh": [-10, -86],
        "re": [1, -103],
        "rh": [4, -124],
        "lk": [-9, -40],
        "lf": [-14, 0],
        "rk": [9, -40],
        "rf": [14, 0]
      },
      "z": {
        "re": -4,
        "rh": -14
      },
      "rot": 0.05,
      "hy": 0.2
    },
    {
      "joints": {
        "head": [-1, -150],
        "neck": [0, -132],
        "hip": [0, -80],
        "le": [-14, -109],
        "lh": [-10, -87],
        "re": [12, -110],
        "rh": [26, -118],
        "lk": [-9, -40],
        "lf": [-14, 0],
        "rk": [9, -40],
        "rf": [14, 0]
      },
      "z": {
        "re": 10,
        "rh": 24
      },
      "hy": 0.05
    },
    {
      "joints": {
        "head": [2, -149],
        "neck": [0, -131],
        "hip": [0, -80],
        "le": [1, -103],
        "lh": [4, -124],
        "re": [14, -108],
        "rh": [10, -86],
        "lk": [-9, -40],
        "lf": [-14, 0],
        "rk": [9, -40],
        "rf": [14, 0]
      },
      "z": {
        "le": 4,
        "lh": 14
      },
      "rot": -0.05,
      "hy": -0.2
    },
    {
      "joints": {
        "head": [1, -150],
        "neck": [0, -132],
        "hip": [0, -80],
        "le": [-12, -110],
        "lh": [-26, -118],
        "re": [14, -109],
        "rh": [10, -87],
        "lk": [-9, -40],
        "lf": [-14, 0],
        "rk": [9, -40],
        "rf": [14, 0]
      },
      "z": {
        "le": -10,
        "lh": -24
      },
      "hy": -0.05
    }
  ]
}
