{
  "id": "anim.prouesse.t3.pistol",
  "version": 1,
  "name": {
    "fr": "Squat sur une jambe"
  },
  "icon": "🦩",
  "move": {
    "style": "prouesse",
    "tier": 3
  },
  "rarity": "rare",
  "loop": {
    "duration": 3.0,
    "weights": [0.36, 0.16, 0.16, 0.32],
    "ease": true
  },
  "flags": {
    "expression": "neutral"
  },
  "sound": [
    {
      "at": 0.36,
      "accent": "hold"
    },
    {
      "at": 0.6,
      "accent": "whoosh"
    }
  ],
  "hands": [
    ["open", "down"],
    ["open", "down"]
  ],
  "frames": [
    {
      "joints": {
        "head": [3.6, -148.9],
        "neck": [3.6, -130.9],
        "hip": [0, -79],
        "le": [29.5, -128.2],
        "lh": [53.4, -125.6],
        "re": [29.5, -128.2],
        "rh": [53.4, -125.6],
        "lk": [6.7, -39.6],
        "lf": [3, 0],
        "rk": [24.1, -48.1],
        "rf": [48.8, -16.6]
      },
      "z": {
        "lk": -2,
        "lf": 2,
        "rk": 8,
        "rf": 8
      }
    },
    {
      "joints": {
        "head": [27.3, -86.0],
        "neck": [21.1, -69.1],
        "hip": [-22, -40],
        "le": [47.1, -70.0],
        "lh": [71.1, -70.8],
        "re": [47.1, -70.0],
        "rh": [71.1, -70.8],
        "lk": [17.8, -36.9],
        "lf": [3, 0],
        "rk": [16.8, -45.5],
        "rf": [56.4, -51.0]
      },
      "z": {
        "lk": -2,
        "lf": 2,
        "rk": 8,
        "rf": 8
      }
    },
    {
      "joints": {
        "head": [26.6, -88.2],
        "neck": [21.1, -71.1],
        "hip": [-21, -40.5],
        "le": [47.0, -72.9],
        "lh": [70.9, -74.6],
        "re": [47.0, -72.9],
        "rh": [70.9, -74.6],
        "lk": [18.8, -36.5],
        "lf": [3, 0],
        "rk": [17.6, -47.3],
        "rf": [57.0, -54.3]
      },
      "z": {
        "lk": -2,
        "lf": 2,
        "rk": 8,
        "rf": 8
      }
    },
    {
      "joints": {
        "head": [2.1, -148.9],
        "neck": [2.7, -130.9],
        "hip": [0, -79],
        "le": [28.7, -129.1],
        "lh": [52.6, -127.4],
        "re": [28.7, -129.1],
        "rh": [52.6, -127.4],
        "lk": [6.7, -39.6],
        "lf": [3, 0],
        "rk": [26.2, -49.9],
        "rf": [53.0, -20.1]
      },
      "z": {
        "lk": -2,
        "lf": 2,
        "rk": 8,
        "rf": 8
      }
    }
  ]
}
