{
  "id": "anim.prouesse.t1.clappushups",
  "version": 1,
  "name": {
    "fr": "Pompes claquées"
  },
  "icon": "👏",
  "move": {
    "style": "prouesse",
    "tier": 1
  },
  "rarity": "common",
  "loop": {
    "duration": 2.4,
    "weights": [0.3, 0.12, 0.12, 0.16, 0.3],
    "ease": true
  },
  "flags": {
    "expression": "angry"
  },
  "sound": [
    {
      "at": 0.42,
      "accent": "impact"
    },
    {
      "at": 0.54,
      "accent": "impact"
    }
  ],
  "hands": [
    ["open", "fwd"],
    ["open", "fwd"]
  ],
  "frames": [
    {
      "joints": {
        "head": [-57.2, -67.6],
        "neck": [-42, -58],
        "hip": [6.9, -40.3],
        "le": [-38.2, -32.3],
        "lh": [-44, -13.0],
        "re": [-38.2, -32.3],
        "rh": [-44, -13.0],
        "lk": [45.5, -26.4],
        "lf": [83.1, -12.8],
        "rk": [45.5, -26.4],
        "rf": [83.1, -12.8]
      },
      "z": {
        "le": -12,
        "lh": -13,
        "re": 12,
        "rh": 13,
        "lk": -7,
        "lf": -8,
        "rk": 7,
        "rf": 8
      }
    },
    {
      "joints": {
        "head": [-58.8, -35.6],
        "neck": [-42, -29],
        "hip": [9.5, -21.9],
        "le": [-20.6, -14.3],
        "lh": [-44, -13.0],
        "re": [-20.6, -14.3],
        "rh": [-44, -13.0],
        "lk": [50.1, -16.2],
        "lf": [89.7, -10.8],
        "rk": [50.1, -16.2],
        "rf": [89.7, -10.8]
      },
      "z": {
        "le": -12,
        "lh": -13,
        "re": 12,
        "rh": 13,
        "lk": -7,
        "lf": -8,
        "rk": 7,
        "rf": 8
      }
    },
    {
      "joints": {
        "head": [-45.6, -91.1],
        "neck": [-32.3, -79.0],
        "hip": [12.8, -53.1],
        "le": [-32.2, -53.3],
        "lh": [-42.3, -41.0],
        "re": [-32.2, -53.3],
        "rh": [-42.3, -41.0],
        "lk": [48.4, -32.7],
        "lf": [83.1, -12.8],
        "rk": [48.4, -32.7],
        "rf": [83.1, -12.8]
      },
      "z": {
        "le": -4.0,
        "lh": 14.0,
        "re": 4.0,
        "rh": -14.0,
        "lk": -7,
        "lf": -8,
        "rk": 7,
        "rf": 8
      }
    },
    {
      "joints": {
        "head": [-57.7, -58.0],
        "neck": [-42.0, -49.3],
        "hip": [7.7, -34.8],
        "le": [-32.9, -26.9],
        "lh": [-44.0, -13.0],
        "re": [-32.9, -26.9],
        "rh": [-44.0, -13.0],
        "lk": [46.9, -23.3],
        "lf": [85.1, -12.2],
        "rk": [46.9, -23.3],
        "rf": [85.1, -12.2]
      },
      "z": {
        "le": -12,
        "lh": -13,
        "re": 12,
        "rh": 13,
        "lk": -7,
        "lf": -8,
        "rk": 7,
        "rf": 8
      }
    },
    {
      "joints": {
        "head": [-57.2, -67.6],
        "neck": [-42, -58],
        "hip": [6.9, -40.3],
        "le": [-38.2, -32.3],
        "lh": [-44, -13.0],
        "re": [-38.2, -32.3],
        "rh": [-44, -13.0],
        "lk": [45.5, -26.4],
        "lf": [83.1, -12.8],
        "rk": [45.5, -26.4],
        "rf": [83.1, -12.8]
      },
      "z": {
        "le": -12,
        "lh": -13,
        "re": 12,
        "rh": 13,
        "lk": -7,
        "lf": -8,
        "rk": 7,
        "rf": 8
      }
    }
  ]
}
