{
  "id": "anim.acrobatie.t0.jumpclap",
  "version": 1,
  "name": {
    "fr": "Saut applaudi"
  },
  "move": {
    "style": "acrobatie",
    "tier": 0
  },
  "rarity": "default",
  "loop": {
    "duration": 1.1,
    "weights": [0.26, 0.24, 0.5],
    "ease": true
  },
  "flags": {
    "expression": "neutral"
  },
  "sound": [
    {
      "at": 0.26,
      "accent": "impact"
    },
    {
      "at": 0.5,
      "accent": "impact"
    }
  ],
  "hands": [
    ["open", "in"],
    ["open", "in"]
  ],
  "frames": [
    {
      "joints": {
        "head": [4, -140],
        "neck": [2, -123],
        "hip": [0, -72],
        "le": [-12, -100],
        "lh": [-24, -80],
        "re": [10, -100],
        "rh": [-2, -82],
        "lk": [-14, -38],
        "lf": [-18, 0],
        "rk": [14, -38],
        "rf": [18, 0]
      },
      "hy": -0.1
    },
    {
      "joints": {
        "head": [0, -156],
        "neck": [0, -138],
        "hip": [0, -86],
        "le": [-8, -163],
        "lh": [-2, -186],
        "re": [8, -163],
        "rh": [2, -186],
        "lk": [-12, -48],
        "lf": [-16, -12],
        "rk": [12, -48],
        "rf": [16, -12]
      },
      "z": {
        "le": 4,
        "lh": 9,
        "re": -4,
        "rh": -9
      },
      "lift": -26
    },
    {
      "joints": {
        "head": [2, -144],
        "neck": [1, -127],
        "hip": [0, -76],
        "le": [-16, -106],
        "lh": [-30, -88],
        "re": [12, -106],
        "rh": [26, -90],
        "lk": [-13, -40],
        "lf": [-18, 0],
        "rk": [13, -40],
        "rf": [18, 0]
      },
      "lift": -3,
      "hy": 0.12
    }
  ]
}
